{
  "$schema": "https://json-schema.org/draft/2020-12/schema",
  "$id": "https://wall-whisperers.local/schemas/wall.schema.json",
  "title": "Climbing Wall",
  "description": "Schema for a climbing wall definition and its holds (Beta Engine MVP).",
  "type": "object",
  "additionalProperties": false,
  "required": ["wall_id", "holds"],
  "properties": {
    "wall_id": {
      "type": "string",
      "pattern": "^[A-Za-z0-9_\\-]{1,64}$",
      "description": "Unique identifier; letters, digits, '-' or '_'."
    },
    "name": { "type": "string" },
    "grid": {
      "type": "object",
      "additionalProperties": false,
      "required": ["cols", "rows"],
      "properties": {
        "cols": { "type": "integer", "minimum": 1, "maximum": 200 },
        "rows": { "type": "integer", "minimum": 1, "maximum": 200 },
        "cell_size_cm": {
          "type": "number",
          "exclusiveMinimum": 0,
          "description": "Real-world size of one grid cell in centimetres. Used by the physics + reachability layers; defaults to 20 cm if absent."
        }
      }
    },
    "wall_angle_deg": {
      "type": "number",
      "minimum": -45,
      "maximum": 45,
      "description": "Deviation from vertical. 0 = vertical, +ve = overhang (top tilted toward the climber), -ve = slab. Physics layer rotates gravity by this angle in the wall-plane."
    },
    "surface_friction": {
      "type": "number",
      "minimum": 0,
      "maximum": 2,
      "description": "Friction coefficient for the bare wall surface (used for smearing). 0 = ice, 0.7 ≈ chalked plastic, 1.0+ ≈ very textured wall."
    },
    "holds": {
      "type": "array",
      "items": { "$ref": "#/$defs/hold" }
    }
  },
  "$defs": {
    "hold": {
      "type": "object",
      "additionalProperties": false,
      "required": [
        "hold_id",
        "grid_x",
        "grid_y",
        "hold_type",
        "orientation_deg",
        "size",
        "color",
        "is_start",
        "is_finish"
      ],
      "properties": {
        "hold_id": { "type": "string", "minLength": 1 },
        "grid_x": { "type": "integer", "minimum": 0 },
        "grid_y": { "type": "integer", "minimum": 0, "description": "0 = bottom of wall (climbing convention)." },
        "hold_type": {
          "type": "string",
          "enum": ["jug", "crimp", "sloper", "pinch", "foothold"]
        },
        "orientation_deg": {
          "type": "number",
          "minimum": 0,
          "exclusiveMaximum": 360,
          "description": "0 = up, increases clockwise; indicates the direction of pull/grip."
        },
        "size": { "type": "string", "enum": ["small", "medium", "large"] },
        "color": {
          "type": "string",
          "minLength": 1,
          "description": "Hex code (#RRGGBB) or any free-form color name."
        },
        "is_start": { "type": "boolean" },
        "is_finish": { "type": "boolean" },
        "friction": {
          "type": "number",
          "minimum": 0,
          "maximum": 2,
          "description": "Per-hold friction coefficient. Optional; physics layer falls back to a per-type default if absent."
        },
        "positivity": {
          "type": "number",
          "minimum": 0,
          "maximum": 1,
          "description": "How much the hold mechanically catches the hand/foot. 1 = a perfect bucket, 0 = a tiny smear. Drives max usable force in the physics layer."
        },
        "max_force_n": {
          "type": "number",
          "minimum": 0,
          "description": "Optional explicit cap on the load this hold can take in newtons. If absent, derived from positivity + grip strength."
        }
      }
    }
  }
}
